{
  "schema_version": "1.0",
  "generated_at": "2026-10-26T06:00:47Z",
  "valid_until": "2026-10-26T21:00:47Z",
  "status": "ok",
  "market": {
    "regime": "sideways",
    "confidence": 0.08,
    "risk_level": "elevated",
    "breadth": {
      "bull": 0,
      "bear": 6,
      "sideways": 2
    },
    "sentiment": -1,
    "themes": [
      "BTC rond $80K, weekend kort onder $79.300",
      "~$773M BTC-ETF-uitstroom do/vr",
      "US-Iran-spanning, Brent ~$115",
      "Trump: geen Iran-aanval zondag",
      "FOMC-besluit 28 okt"
    ],
    "summary_nl": "BTC staat zijwaarts met zeer lage confidence; zes andere coins zitten in een bear-regime en XRP is sideways, dus marktregime sideways. De markt blijft risk-off na circa $773M BTC-ETF-uitstroom en aanhoudende US-Iran-spanning met hoge olieprijzen; Trump zei zondag dat er die dag geen aanval kwam. In de komende 24 uur geen high-impact events gevonden; het FOMC-besluit volgt op 28 oktober."
  },
  "assets": {
    "ADA_USD": {
      "regime": "bear",
      "trend_strength": 0.49,
      "volatility": "normal",
      "risk_level": "elevated",
      "confidence": 0.69,
      "tradable": true,
      "notes": "Risico verhoogd naar elevated door marktbrede risk-off: ~$773M BTC-ETF-uitstroom do/vr en US-Iran-spanning met Brent rond $115.",
      "indicators": {
        "close": 0.20405,
        "ema10_d": 0.21442685,
        "ema30_d": 0.2262775,
        "ema30_slope_5d": -0.03194,
        "adx14_d": 24.41,
        "atr14_pct": 0.06444,
        "atr_ratio_vs_median": 1.0,
        "h4_trend": -1,
        "last_candle": "2026-10-26T00:00:00Z",
        "candles_daily": 50
      }
    },
    "AVAX_USD": {
      "regime": "bear",
      "trend_strength": 0.46,
      "volatility": "normal",
      "risk_level": "elevated",
      "confidence": 0.66,
      "tradable": true,
      "notes": "Risico verhoogd naar elevated door marktbrede risk-off: ~$773M BTC-ETF-uitstroom do/vr en US-Iran-spanning met Brent rond $115.",
      "indicators": {
        "close": 8.895,
        "ema10_d": 9.31814196,
        "ema30_d": 9.72863987,
        "ema30_slope_5d": -0.02928,
        "adx14_d": 22.89,
        "atr14_pct": 0.06367,
        "atr_ratio_vs_median": 0.93,
        "h4_trend": -1,
        "last_candle": "2026-10-26T00:00:00Z",
        "candles_daily": 50
      }
    },
    "BTC_USD": {
      "regime": "sideways",
      "trend_strength": 0.33,
      "volatility": "normal",
      "risk_level": "elevated",
      "confidence": 0.18,
      "tradable": false,
      "notes": "Confidence 0,18 onder 0,25: regime onzeker, niet handelbaar.",
      "indicators": {
        "close": 80143.72,
        "ema10_d": 81321.60583419,
        "ema30_d": 82002.17343996,
        "ema30_slope_5d": -0.00656,
        "adx14_d": 16.52,
        "atr14_pct": 0.02511,
        "atr_ratio_vs_median": 0.94,
        "h4_trend": -1,
        "last_candle": "2026-10-26T00:00:00Z",
        "candles_daily": 50
      }
    },
    "DOGE_USD": {
      "regime": "bear",
      "trend_strength": 0.55,
      "volatility": "normal",
      "risk_level": "elevated",
      "confidence": 0.75,
      "tradable": true,
      "notes": "Risico verhoogd naar elevated door marktbrede risk-off: ~$773M BTC-ETF-uitstroom do/vr en US-Iran-spanning met Brent rond $115.",
      "indicators": {
        "close": 0.077127,
        "ema10_d": 0.07923728,
        "ema30_d": 0.08363388,
        "ema30_slope_5d": -0.02725,
        "adx14_d": 27.68,
        "atr14_pct": 0.04924,
        "atr_ratio_vs_median": 0.87,
        "h4_trend": -1,
        "last_candle": "2026-10-26T00:00:00Z",
        "candles_daily": 50
      }
    },
    "ETH_USD": {
      "regime": "bear",
      "trend_strength": 0.55,
      "volatility": "normal",
      "risk_level": "elevated",
      "confidence": 0.75,
      "tradable": true,
      "notes": "Risico verhoogd naar elevated door marktbrede risk-off: ~$773M BTC-ETF-uitstroom do/vr en US-Iran-spanning met Brent rond $115.",
      "indicators": {
        "close": 2324.17,
        "ema10_d": 2387.53676628,
        "ema30_d": 2471.96253031,
        "ema30_slope_5d": -0.01863,
        "adx14_d": 27.27,
        "atr14_pct": 0.03879,
        "atr_ratio_vs_median": 1.0,
        "h4_trend": -1,
        "last_candle": "2026-10-26T00:00:00Z",
        "candles_daily": 50
      }
    },
    "LINK_USD": {
      "regime": "bear",
      "trend_strength": 0.5,
      "volatility": "normal",
      "risk_level": "elevated",
      "confidence": 0.7,
      "tradable": true,
      "notes": "Risico verhoogd naar elevated door marktbrede risk-off: ~$773M BTC-ETF-uitstroom do/vr en US-Iran-spanning met Brent rond $115.",
      "indicators": {
        "close": 11.439,
        "ema10_d": 11.90909703,
        "ema30_d": 12.48025017,
        "ema30_slope_5d": -0.02614,
        "adx14_d": 24.76,
        "atr14_pct": 0.05609,
        "atr_ratio_vs_median": 0.96,
        "h4_trend": -1,
        "last_candle": "2026-10-26T00:00:00Z",
        "candles_daily": 50
      }
    },
    "SOL_USD": {
      "regime": "bear",
      "trend_strength": 0.53,
      "volatility": "normal",
      "risk_level": "elevated",
      "confidence": 0.73,
      "tradable": true,
      "notes": "Risico verhoogd naar elevated door marktbrede risk-off: ~$773M BTC-ETF-uitstroom do/vr en US-Iran-spanning met Brent rond $115.",
      "indicators": {
        "close": 101.25,
        "ema10_d": 103.65429157,
        "ema30_d": 107.32889175,
        "ema30_slope_5d": -0.01881,
        "adx14_d": 26.35,
        "atr14_pct": 0.04234,
        "atr_ratio_vs_median": 0.94,
        "h4_trend": -1,
        "last_candle": "2026-10-26T00:00:00Z",
        "candles_daily": 50
      }
    },
    "XRP_USD": {
      "regime": "sideways",
      "trend_strength": 0.39,
      "volatility": "normal",
      "risk_level": "elevated",
      "confidence": 0.24,
      "tradable": false,
      "notes": "Confidence 0,24 onder 0,25: regime onzeker, niet handelbaar.",
      "indicators": {
        "close": 1.2891,
        "ema10_d": 1.31286462,
        "ema30_d": 1.3622742,
        "ema30_slope_5d": -0.01879,
        "adx14_d": 19.6,
        "atr14_pct": 0.04435,
        "atr_ratio_vs_median": 0.85,
        "h4_trend": -1,
        "last_candle": "2026-10-26T00:00:00Z",
        "candles_daily": 50
      }
    }
  },
  "events": [],
  "chaos_windows": [],
  "sources": [
    "https://exchange.crypto.com",
    "https://www.kucoin.com/news/articles/crypto-daily-market-report-october-26-2026",
    "https://en.coin-turk.com/bitcoin-falls-below-80000-239m-in-btc-longs-liquidated-as-etf-outflows-hit-773m/",
    "https://thecurrencyanalytics.com/bitcoin/bitcoin-tests-80000-support-trump-iran-strike-306074",
    "https://www.benzinga.com/news/politics/26/10/62581355/trump-iran-strike-oil-prices",
    "https://www.kiplinger.com/investing/economy/this-weeks-economic-calendar",
    "https://cryptotimes.io/2026/10/24/x100-hack-attackers-hijack-governance-drain-4-85m-as-x-token-crashes-96",
    "https://thecryptobasic.com/2026/10/25/tcb-daily-edition-what-happened-in-crypto-on-october-25-2026/"
  ]
}
