{
  "schema_version": "1.0",
  "generated_at": "2026-10-13T09:19:27Z",
  "valid_until": "2026-10-14T00:19:27Z",
  "status": "ok",
  "market": {
    "regime": "bull",
    "confidence": 0.24,
    "risk_level": "elevated",
    "breadth": {
      "bull": 2,
      "bear": 3,
      "sideways": 3
    },
    "sentiment": -1,
    "themes": [
      "long-liquidaties",
      "ETF-uitstroom",
      "Fed-renteverhoging verwacht",
      "US CPI 14 okt",
      "10j-rente boven 5%"
    ],
    "summary_nl": "BTC staat technisch nog net in een zwak bull-regime, maar de breadth is verdeeld (ETH, SOL en XRP bear) en de confidence is laag. In 24 uur werd circa $672 mln aan vooral longs geliquideerd en de crypto-ETF's zagen in oktober al ruim $1 mrd uitstroom. Morgen 12:30 UTC volgt de Amerikaanse CPI, met havikachtige Fed-signalen op de achtergrond."
  },
  "assets": {
    "ADA_USD": {
      "regime": "sideways",
      "trend_strength": 0.41,
      "volatility": "normal",
      "risk_level": "elevated",
      "confidence": 0.26,
      "tradable": true,
      "notes": "Elevated door normale volatiliteit met lage confidence.",
      "indicators": {
        "close": 0.23579,
        "ema10_d": 0.24459943,
        "ema30_d": 0.23984892,
        "ema30_slope_5d": 0.00373,
        "adx14_d": 20.42,
        "atr14_pct": 0.07238,
        "atr_ratio_vs_median": 1.18,
        "h4_trend": -1,
        "last_candle": "2026-10-13T00:00:00Z",
        "candles_daily": 50
      }
    },
    "AVAX_USD": {
      "regime": "bull",
      "trend_strength": 0.58,
      "volatility": "normal",
      "risk_level": "elevated",
      "confidence": 0.43,
      "tradable": true,
      "notes": "Elevated door normale volatiliteit met lage confidence.",
      "indicators": {
        "close": 10.341,
        "ema10_d": 10.57748097,
        "ema30_d": 10.13326287,
        "ema30_slope_5d": 0.01142,
        "adx14_d": 29.18,
        "atr14_pct": 0.06871,
        "atr_ratio_vs_median": 1.13,
        "h4_trend": -1,
        "last_candle": "2026-10-13T00:00:00Z",
        "candles_daily": 50
      }
    },
    "BTC_USD": {
      "regime": "bull",
      "trend_strength": 0.49,
      "volatility": "normal",
      "risk_level": "elevated",
      "confidence": 0.34,
      "tradable": true,
      "notes": "Elevated: marktbreed risico door grote long-liquidaties, ETF-uitstroom en CPI morgen.",
      "indicators": {
        "close": 83495.91,
        "ema10_d": 83326.81736868,
        "ema30_d": 82723.06934375,
        "ema30_slope_5d": 0.00081,
        "adx14_d": 24.46,
        "atr14_pct": 0.0264,
        "atr_ratio_vs_median": 0.94,
        "h4_trend": 0,
        "last_candle": "2026-10-13T00:00:00Z",
        "candles_daily": 50
      }
    },
    "DOGE_USD": {
      "regime": "sideways",
      "trend_strength": 0.39,
      "volatility": "normal",
      "risk_level": "elevated",
      "confidence": 0.24,
      "tradable": false,
      "notes": "Niet tradable: confidence onder 0,25.",
      "indicators": {
        "close": 0.084154,
        "ema10_d": 0.08714438,
        "ema30_d": 0.08927048,
        "ema30_slope_5d": -0.01979,
        "adx14_d": 19.41,
        "atr14_pct": 0.05691,
        "atr_ratio_vs_median": 1.0,
        "h4_trend": -1,
        "last_candle": "2026-10-13T00:00:00Z",
        "candles_daily": 50
      }
    },
    "ETH_USD": {
      "regime": "bear",
      "trend_strength": 0.57,
      "volatility": "normal",
      "risk_level": "elevated",
      "confidence": 0.77,
      "tradable": true,
      "notes": "Verhoogd naar elevated: aanhoudende Ether-ETF-uitstroom (negen sessies op rij).",
      "indicators": {
        "close": 2511.64,
        "ema10_d": 2546.75871398,
        "ema30_d": 2580.9535132,
        "ema30_slope_5d": -0.01286,
        "adx14_d": 28.38,
        "atr14_pct": 0.03612,
        "atr_ratio_vs_median": 0.99,
        "h4_trend": -1,
        "last_candle": "2026-10-13T00:00:00Z",
        "candles_daily": 50
      }
    },
    "LINK_USD": {
      "regime": "sideways",
      "trend_strength": 0.48,
      "volatility": "normal",
      "risk_level": "elevated",
      "confidence": 0.33,
      "tradable": true,
      "notes": "Elevated door normale volatiliteit met lage confidence.",
      "indicators": {
        "close": 12.925,
        "ema10_d": 13.19354375,
        "ema30_d": 13.11082013,
        "ema30_slope_5d": -0.00536,
        "adx14_d": 23.85,
        "atr14_pct": 0.05873,
        "atr_ratio_vs_median": 1.03,
        "h4_trend": -1,
        "last_candle": "2026-10-13T00:00:00Z",
        "candles_daily": 50
      }
    },
    "SOL_USD": {
      "regime": "bear",
      "trend_strength": 0.54,
      "volatility": "normal",
      "risk_level": "elevated",
      "confidence": 0.74,
      "tradable": true,
      "notes": "Verhoogd naar elevated: marktbreed risico (liquidaties, ETF-uitstroom, CPI morgen).",
      "indicators": {
        "close": 107.32,
        "ema10_d": 111.55324943,
        "ema30_d": 112.18211805,
        "ema30_slope_5d": -0.01268,
        "adx14_d": 27.14,
        "atr14_pct": 0.04814,
        "atr_ratio_vs_median": 1.02,
        "h4_trend": -1,
        "last_candle": "2026-10-13T00:00:00Z",
        "candles_daily": 50
      }
    },
    "XRP_USD": {
      "regime": "bear",
      "trend_strength": 0.45,
      "volatility": "normal",
      "risk_level": "elevated",
      "confidence": 0.65,
      "tradable": true,
      "notes": "Verhoogd naar elevated: marktbreed risico (liquidaties, ETF-uitstroom, CPI morgen).",
      "indicators": {
        "close": 1.3678,
        "ema10_d": 1.40988844,
        "ema30_d": 1.43620518,
        "ema30_slope_5d": -0.01497,
        "adx14_d": 22.43,
        "atr14_pct": 0.05001,
        "atr_ratio_vs_median": 0.91,
        "h4_trend": -1,
        "last_candle": "2026-10-13T00:00:00Z",
        "candles_daily": 50
      }
    }
  },
  "events": [
    {
      "time_utc": "2026-10-14T02:10:00Z",
      "title": "ECB-president Lagarde spreekt",
      "importance": "low",
      "assets": [
        "ALL"
      ],
      "source": "https://investinglive.com/news/week-ahead-us-inflation-and-retail-sales-lead-a-busy-economic-calendar-be-aware/"
    },
    {
      "time_utc": "2026-10-14T09:40:00Z",
      "title": "Fed Vice Chair for Supervision Bowman, gesprek over toezicht en regelgeving (IIF Bangkok)",
      "importance": "medium",
      "assets": [
        "ALL"
      ],
      "source": "https://www.federalreserve.gov/newsevents/2026-october.htm"
    },
    {
      "time_utc": "2026-10-14T12:30:00Z",
      "title": "Amerikaanse CPI september",
      "importance": "high",
      "assets": [
        "ALL"
      ],
      "source": "https://investinglive.com/news/week-ahead-us-inflation-and-retail-sales-lead-a-busy-economic-calendar-be-aware/"
    }
  ],
  "chaos_windows": [
    {
      "start_utc": "2026-10-14T11:30:00Z",
      "end_utc": "2026-10-14T14:30:00Z",
      "assets": [
        "ALL"
      ],
      "reason": "Amerikaanse CPI september (12:30 UTC)"
    }
  ],
  "sources": [
    "https://exchange.crypto.com",
    "https://www.kucoin.com/news/articles/crypto-daily-market-report-october-13-2026",
    "https://www.coingabbar.com/en/crypto-news-today-october-13-2026-bitcoin-ethereum-price",
    "https://cryptoticker.io/en/crypto-etf-outflows-october-2026-bitcoin-ethereum/",
    "https://investinglive.com/news/week-ahead-us-inflation-and-retail-sales-lead-a-busy-economic-calendar-be-aware/",
    "https://www.federalreserve.gov/newsevents/2026-october.htm",
    "https://cryptotimes.io/2026/10/12/crypto-token-unlocks-reach-155m-as-cro-leads-weekly-releases"
  ]
}