{
  "schema_version": "1.0",
  "generated_at": "2026-10-15T17:01:29Z",
  "valid_until": "2026-10-16T08:01:29Z",
  "status": "ok",
  "market": {
    "regime": "sideways",
    "confidence": 0.17,
    "risk_level": "elevated",
    "breadth": {
      "bull": 0,
      "bear": 5,
      "sideways": 3
    },
    "sentiment": -1,
    "themes": [
      "hete US PPI (+1,3% m/m)",
      "Fed-renteverhoging okt. ~30%",
      "~$900 mln liquidaties",
      "BTC/ETH ETF-uitstroom",
      "Warsh-toespraak 03:30 UTC"
    ],
    "summary_nl": "BTC staat technisch in een sideways-regime met lage confidence; ETH, SOL, XRP, LINK en DOGE zitten in een bear-regime. De Amerikaanse PPI steeg in september 1,3% m/m (6,3% j/j), de grootste stijging sinds 2022; de kans op een Fed-renteverhoging op 28 oktober ligt rond 30% en in 24 uur werd bijna $900 mln geliquideerd, vooral longs. Vannacht om 03:30 UTC spreekt Fed-voorzitter Warsh."
  },
  "assets": {
    "ADA_USD": {
      "regime": "sideways",
      "trend_strength": 0.39,
      "volatility": "normal",
      "risk_level": "elevated",
      "confidence": 0.24,
      "tradable": false,
      "notes": "Niet tradable: confidence onder 0,25; elevated door normale volatiliteit en marktrisico.",
      "indicators": {
        "close": 0.22875,
        "ema10_d": 0.23952349,
        "ema30_d": 0.23868687,
        "ema30_slope_5d": -0.00572,
        "adx14_d": 19.68,
        "atr14_pct": 0.07292,
        "atr_ratio_vs_median": 1.17,
        "h4_trend": -1,
        "last_candle": "2026-10-15T00:00:00Z",
        "candles_daily": 50
      }
    },
    "AVAX_USD": {
      "regime": "sideways",
      "trend_strength": 0.52,
      "volatility": "normal",
      "risk_level": "elevated",
      "confidence": 0.37,
      "tradable": true,
      "notes": "Elevated door normale volatiliteit met lage confidence en marktbreed risico.",
      "indicators": {
        "close": 9.924,
        "ema10_d": 10.35873032,
        "ema30_d": 10.11205228,
        "ema30_slope_5d": 0.00433,
        "adx14_d": 26.1,
        "atr14_pct": 0.07103,
        "atr_ratio_vs_median": 1.14,
        "h4_trend": -1,
        "last_candle": "2026-10-15T00:00:00Z",
        "candles_daily": 50
      }
    },
    "BTC_USD": {
      "regime": "sideways",
      "trend_strength": 0.42,
      "volatility": "normal",
      "risk_level": "elevated",
      "confidence": 0.27,
      "tradable": true,
      "notes": "Elevated; marktbreed risico door hete PPI en Warsh-toespraak vannacht.",
      "indicators": {
        "close": 82033.9,
        "ema10_d": 82787.35641452,
        "ema30_d": 82649.73420644,
        "ema30_slope_5d": -0.00123,
        "adx14_d": 20.92,
        "atr14_pct": 0.02792,
        "atr_ratio_vs_median": 0.99,
        "h4_trend": -1,
        "last_candle": "2026-10-15T00:00:00Z",
        "candles_daily": 50
      }
    },
    "DOGE_USD": {
      "regime": "bear",
      "trend_strength": 0.4,
      "volatility": "normal",
      "risk_level": "elevated",
      "confidence": 0.6,
      "tradable": true,
      "notes": "Verhoogd naar elevated: marktbreed risico (hete PPI, ~$900 mln liquidaties, ETF-uitstroom).",
      "indicators": {
        "close": 0.080642,
        "ema10_d": 0.08518268,
        "ema30_d": 0.08838842,
        "ema30_slope_5d": -0.02379,
        "adx14_d": 20.1,
        "atr14_pct": 0.05888,
        "atr_ratio_vs_median": 1.02,
        "h4_trend": -1,
        "last_candle": "2026-10-15T00:00:00Z",
        "candles_daily": 50
      }
    },
    "ETH_USD": {
      "regime": "bear",
      "trend_strength": 0.55,
      "volatility": "normal",
      "risk_level": "high",
      "confidence": 0.75,
      "tradable": true,
      "notes": "Verhoogd naar high: ETH ~6% lager met $265–290 mln long-liquidaties bovenop marktbreed risico.",
      "indicators": {
        "close": 2432.77,
        "ema10_d": 2505.13685093,
        "ema30_d": 2563.04186577,
        "ema30_slope_5d": -0.0153,
        "adx14_d": 27.42,
        "atr14_pct": 0.03951,
        "atr_ratio_vs_median": 1.06,
        "h4_trend": -1,
        "last_candle": "2026-10-15T00:00:00Z",
        "candles_daily": 50
      }
    },
    "LINK_USD": {
      "regime": "bear",
      "trend_strength": 0.46,
      "volatility": "normal",
      "risk_level": "elevated",
      "confidence": 0.66,
      "tradable": true,
      "notes": "Verhoogd naar elevated: marktbreed risico (hete PPI, ~$900 mln liquidaties, ETF-uitstroom).",
      "indicators": {
        "close": 12.411,
        "ema10_d": 12.9304274,
        "ema30_d": 13.04304903,
        "ema30_slope_5d": -0.01019,
        "adx14_d": 23.18,
        "atr14_pct": 0.06145,
        "atr_ratio_vs_median": 1.06,
        "h4_trend": -1,
        "last_candle": "2026-10-15T00:00:00Z",
        "candles_daily": 50
      }
    },
    "SOL_USD": {
      "regime": "bear",
      "trend_strength": 0.5,
      "volatility": "normal",
      "risk_level": "elevated",
      "confidence": 0.7,
      "tradable": true,
      "notes": "Verhoogd naar elevated: marktbreed risico (hete PPI, ~$900 mln liquidaties, ETF-uitstroom).",
      "indicators": {
        "close": 105.44,
        "ema10_d": 109.27508872,
        "ema30_d": 111.66777108,
        "ema30_slope_5d": -0.01807,
        "adx14_d": 24.92,
        "atr14_pct": 0.04904,
        "atr_ratio_vs_median": 1.08,
        "h4_trend": -1,
        "last_candle": "2026-10-15T00:00:00Z",
        "candles_daily": 50
      }
    },
    "XRP_USD": {
      "regime": "bear",
      "trend_strength": 0.46,
      "volatility": "normal",
      "risk_level": "elevated",
      "confidence": 0.66,
      "tradable": true,
      "notes": "Verhoogd naar elevated: marktbreed risico (hete PPI, ~$900 mln liquidaties, ETF-uitstroom).",
      "indicators": {
        "close": 1.3336,
        "ema10_d": 1.38378427,
        "ema30_d": 1.42373325,
        "ema30_slope_5d": -0.01916,
        "adx14_d": 22.75,
        "atr14_pct": 0.0507,
        "atr_ratio_vs_median": 0.93,
        "h4_trend": -1,
        "last_candle": "2026-10-15T00:00:00Z",
        "candles_daily": 50
      }
    }
  },
  "events": [
    {
      "time_utc": "2026-10-16T03:30:00Z",
      "title": "Fed-voorzitter Warsh in gesprek met IMF-directeur Georgieva (Bangkok)",
      "importance": "high",
      "assets": [
        "ALL"
      ],
      "source": "https://www.federalreserve.gov/newsevents/2026-october.htm"
    },
    {
      "time_utc": "2026-10-16T13:15:00Z",
      "title": "US industriële productie en capaciteitsbenutting (G.17)",
      "importance": "low",
      "assets": [
        "ALL"
      ],
      "source": "https://www.federalreserve.gov/newsevents/2026-october.htm"
    }
  ],
  "chaos_windows": [
    {
      "start_utc": "2026-10-16T02:30:00Z",
      "end_utc": "2026-10-16T05:30:00Z",
      "assets": [
        "ALL"
      ],
      "reason": "Toespraak Fed-voorzitter Warsh (03:30 UTC) na hete CPI/PPI"
    }
  ],
  "sources": [
    "https://exchange.crypto.com",
    "https://www.cryptotimes.io/2026/10/15/why-is-the-crypto-market-down-today-bitcoin-and-ethereum-price-update/",
    "https://www.freedom969.com/us-news/us-producer-prices-post-largest-gain-in-4-1-2-years-retail-sales-beat-expectations",
    "https://finance.yahoo.com/personal-finance/investing/article/bitcoin-and-ethereum-prices-today-thursday-october-15-2026-crypto-prices-falling-into-a-familiar-pattern-113540042.html",
    "https://financefeeds.com/bitcoin-and-ethereum-etfs-reverse-course-on-october-14-as-fidelity-sees-152-7-million-exit/",
    "https://www.federalreserve.gov/newsevents/2026-october.htm",
    "https://www.kucoin.com/news/insight/BTC/6accd7b4f25df50007499e94",
    "https://ambcrypto.com/cryptos-security-crisis-deepens-3-exploits-rattle-the-market-in-24-hours/",
    "https://calebandbrown.com/blog/weekly-rollup-october-13-2026/",
    "https://en.bitcoinsistemi.com/watch-out-major-token-unlocks-are-coming-for-18-altcoins-this-week-here-s-the-day-by-day-hour-by-hou/"
  ]
}