{
  "schema_version": "1.0",
  "generated_at": "2026-10-13T17:06:17Z",
  "valid_until": "2026-10-14T08:06:17Z",
  "status": "ok",
  "market": {
    "regime": "bull",
    "confidence": 0.24,
    "risk_level": "elevated",
    "breadth": {
      "bull": 2,
      "bear": 3,
      "sideways": 3
    },
    "sentiment": -1,
    "themes": [
      "long-liquidaties",
      "ETF-uitstroom",
      "US CPI 14 okt",
      "chip-selloff Azië",
      "sterke dollar/hoge rente"
    ],
    "summary_nl": "BTC blijft technisch in een zwak bull-regime met lage confidence; de breadth is verdeeld (ETH, SOL en XRP bear). In 24 uur werd circa $771 mln aan vooral longs geliquideerd, crypto-ETF's zien aanhoudende uitstroom en Aziatische aandelen (KOSPI −5,5%) gingen hard onderuit. Morgen 12:30 UTC volgt de Amerikaanse CPI."
  },
  "assets": {
    "ADA_USD": {
      "regime": "sideways",
      "trend_strength": 0.41,
      "volatility": "normal",
      "risk_level": "elevated",
      "confidence": 0.26,
      "tradable": true,
      "notes": "Elevated door normale volatiliteit met lage confidence.",
      "indicators": {
        "close": 0.23585,
        "ema10_d": 0.24461034,
        "ema30_d": 0.23985279,
        "ema30_slope_5d": 0.00375,
        "adx14_d": 20.42,
        "atr14_pct": 0.07237,
        "atr_ratio_vs_median": 1.18,
        "h4_trend": -1,
        "last_candle": "2026-10-13T00:00:00Z",
        "candles_daily": 50
      }
    },
    "AVAX_USD": {
      "regime": "bull",
      "trend_strength": 0.58,
      "volatility": "normal",
      "risk_level": "elevated",
      "confidence": 0.43,
      "tradable": true,
      "notes": "Elevated door normale volatiliteit met lage confidence.",
      "indicators": {
        "close": 10.275,
        "ema10_d": 10.56548097,
        "ema30_d": 10.12900481,
        "ema30_slope_5d": 0.01099,
        "adx14_d": 29.18,
        "atr14_pct": 0.06916,
        "atr_ratio_vs_median": 1.14,
        "h4_trend": -1,
        "last_candle": "2026-10-13T00:00:00Z",
        "candles_daily": 50
      }
    },
    "BTC_USD": {
      "regime": "bull",
      "trend_strength": 0.49,
      "volatility": "normal",
      "risk_level": "elevated",
      "confidence": 0.34,
      "tradable": true,
      "notes": "Elevated: marktbreed risico (long-liquidaties, ETF-uitstroom, CPI morgen).",
      "indicators": {
        "close": 83371.23,
        "ema10_d": 83304.14827777,
        "ema30_d": 82715.02547279,
        "ema30_slope_5d": 0.00072,
        "adx14_d": 24.46,
        "atr14_pct": 0.02644,
        "atr_ratio_vs_median": 0.94,
        "h4_trend": 0,
        "last_candle": "2026-10-13T00:00:00Z",
        "candles_daily": 50
      }
    },
    "DOGE_USD": {
      "regime": "sideways",
      "trend_strength": 0.39,
      "volatility": "normal",
      "risk_level": "elevated",
      "confidence": 0.24,
      "tradable": false,
      "notes": "Niet tradable: confidence onder 0,25.",
      "indicators": {
        "close": 0.084512,
        "ema10_d": 0.08720948,
        "ema30_d": 0.08929358,
        "ema30_slope_5d": -0.01954,
        "adx14_d": 19.41,
        "atr14_pct": 0.05667,
        "atr_ratio_vs_median": 1.0,
        "h4_trend": -1,
        "last_candle": "2026-10-13T00:00:00Z",
        "candles_daily": 50
      }
    },
    "ETH_USD": {
      "regime": "bear",
      "trend_strength": 0.57,
      "volatility": "normal",
      "risk_level": "elevated",
      "confidence": 0.77,
      "tradable": true,
      "notes": "Verhoogd naar elevated: aanhoudende Ether-ETF-uitstroom (negen sessies op rij).",
      "indicators": {
        "close": 2513.65,
        "ema10_d": 2547.12416852,
        "ema30_d": 2581.08319062,
        "ema30_slope_5d": -0.01281,
        "adx14_d": 28.38,
        "atr14_pct": 0.03609,
        "atr_ratio_vs_median": 0.99,
        "h4_trend": -1,
        "last_candle": "2026-10-13T00:00:00Z",
        "candles_daily": 50
      }
    },
    "LINK_USD": {
      "regime": "sideways",
      "trend_strength": 0.48,
      "volatility": "normal",
      "risk_level": "elevated",
      "confidence": 0.33,
      "tradable": true,
      "notes": "Elevated door normale volatiliteit met lage confidence.",
      "indicators": {
        "close": 12.926,
        "ema10_d": 13.19372557,
        "ema30_d": 13.11088465,
        "ema30_slope_5d": -0.00536,
        "adx14_d": 23.85,
        "atr14_pct": 0.05872,
        "atr_ratio_vs_median": 1.03,
        "h4_trend": -1,
        "last_candle": "2026-10-13T00:00:00Z",
        "candles_daily": 50
      }
    },
    "SOL_USD": {
      "regime": "bear",
      "trend_strength": 0.54,
      "volatility": "normal",
      "risk_level": "elevated",
      "confidence": 0.74,
      "tradable": true,
      "notes": "Verhoogd naar elevated: marktbreed risico (long-liquidaties, ETF-uitstroom, CPI morgen).",
      "indicators": {
        "close": 107.59,
        "ema10_d": 111.60234034,
        "ema30_d": 112.19953741,
        "ema30_slope_5d": -0.01253,
        "adx14_d": 27.14,
        "atr14_pct": 0.04802,
        "atr_ratio_vs_median": 1.01,
        "h4_trend": -1,
        "last_candle": "2026-10-13T00:00:00Z",
        "candles_daily": 50
      }
    },
    "XRP_USD": {
      "regime": "bear",
      "trend_strength": 0.45,
      "volatility": "normal",
      "risk_level": "elevated",
      "confidence": 0.65,
      "tradable": true,
      "notes": "Verhoogd naar elevated: marktbreed risico (long-liquidaties, ETF-uitstroom, CPI morgen).",
      "indicators": {
        "close": 1.369,
        "ema10_d": 1.41010662,
        "ema30_d": 1.4362826,
        "ema30_slope_5d": -0.01491,
        "adx14_d": 22.43,
        "atr14_pct": 0.04997,
        "atr_ratio_vs_median": 0.91,
        "h4_trend": -1,
        "last_candle": "2026-10-13T00:00:00Z",
        "candles_daily": 50
      }
    }
  },
  "events": [
    {
      "time_utc": "2026-10-14T12:30:00Z",
      "title": "Amerikaanse CPI september",
      "importance": "high",
      "assets": [
        "ALL"
      ],
      "source": "https://features.financialjuice.com/2026/10/12/us-cpi-prep-14th-october/"
    }
  ],
  "chaos_windows": [
    {
      "start_utc": "2026-10-14T11:30:00Z",
      "end_utc": "2026-10-14T14:30:00Z",
      "assets": [
        "ALL"
      ],
      "reason": "Amerikaanse CPI september (12:30 UTC)"
    }
  ],
  "sources": [
    "https://exchange.crypto.com",
    "https://bitcoinfoundation.org/news/analysis/why-is-crypto-down-today-bitcoin-sell-off-deepens-as-771m-in-leveraged-bets-get-wiped-out/",
    "https://analyticsinsight.net/price-analysis/crypto-prices-today-bitcoin-holds-near-usd-83750-as-etf-outflows-and-cpi-risk-test-support",
    "https://tedpillows.substack.com/p/crypto-and-finance-market-report-acb",
    "https://features.financialjuice.com/2026/10/12/us-cpi-prep-14th-october/",
    "https://startupfortune.com/binance-pays-283-million-after-its-own-price-feed-broke-a-stablecoin-that-never-actually-broke"
  ]
}